### ISSUE TITLE
Support opening an app (like with Siri shortcuts)

### ISSUE THREAD

**Issue by postlund** [postlund/pyatv#303]
**Short feature/function description**
Since it's possible to open apps on tvOS using Siri shortcuts, it would be great if `pyatv` could do that as well. I am not sure how that API works or even which messages are involved, so that would be a first step to investigate. Adding a new interface to launch the app needs to be done.

An idea is to see if the proxy can be used to intercept the traffic, ("launch app on ATVProxy") but my tests have failed so far so it needs some additional work.

**What needs to be done?**
TBD

**Is this a breaking change?**
No

**Anything else worth knowing?**
Somewhat relates to #302. A generic API should be added but only `MRP` will implement it.

**Comment by postlund** [comment]
I can't really drop this yet, it's peculiar. Took a tcpdump when running a shortcut opening the TV app on my Apple TV:
```
06:52:22.882789 IP (tos 0x2,ECT(0), ttl 64, id 0, offset 0, flags [DF], proto TCP (6), length 135)
    10.0.10.106.49432 > 10.0.10.81.49153: Flags [P.], cksum 0xeb3f (correct), seq 1237:1320, ack 681, win 2048, options [nop,nop,TS val 423254996 ecr 2377005098], length 83
06:52:22.883415 IP (tos 0x0, ttl 64, id 0, offset 0, flags [DF], proto TCP (6), length 52)
    10.0.10.81.49153 > 10.0.10.106.49432: Flags [.], cksum 0x1da2 (correct), seq 681, ack 1320, win 2046, options [nop,nop,TS val 2377010372 ecr 423254996], length 0
06:52:22.907669 IP (tos 0x2,ECT(0), ttl 64, id 0, offset 0, flags [DF], proto TCP (6), length 89)
    10.0.10.81.49153 > 10.0.10.106.49432: Flags [P.], cksum 0xc3f2 (correct), seq 681:718, ack 1320, win 2048, options [nop,nop,TS val 2377010396 ecr 423254996], length 37
06:52:22.914892 IP (tos 0x0, ttl 64, id 0, offset 0, flags [DF], proto TCP (6), length 52)
    10.0.10.106.49432 > 10.0.10.81.49153: Flags [.], cksum 0x1d13 (correct), seq 1320, ack 718, win 2047, options [nop,nop,TS val 423255077 ecr 2377010396], length 0
06:52:24.907517 IP (tos 0x0, ttl 52, id 2577, offset 0, flags [none], proto TCP (6), length 105)
    17.242.150.82.5223 > 10.0.10.106.49615: Flags [P.], cksum 0x42cf (correct), seq 1:54, ack 53, win 1452, options [nop,nop,TS val 933343479 ecr 423257039], length 53
```

Looking at the MDNS info reveals that port 49153 corresponds to `_companion-link._tcp.local`, i.e. the companion link protocol. It seems to be used to perform simpler services across devices, e.g. changing volume or play/pause but not much is documented about it on the interwebs.

The packets are likely encrypted somehow, but I have no idea how. Quick look at some packets reveals patterns like these (in both directions):

* 08 00 00 53 <83 additional bytes>
* 08 00 00 25 <37 additional bytes>

Since 0x53=0d83 and 0x25=0d37, this suggests that these are packet lengths. Perhaps 0x08 is a type field? I have seen other values here as well, like 0x05. Can't be sure about length of the fields yet, i.e. if one byte type and three byte length, or two bytes for type and two bytes for length. More data would be needed for that. Or some other combination (perhaps the zeros represents other fields as well).

The MDNS data contains these fields (with bogus values here for reference):
* rpHA = 45efecc5211
* rpHN = 86d44e4f11ff
* rpVr = 195.2
* rpMd = AppleTV6,2
* rpFl = 0x36782
* rpAD = cc5011ae31ee
* rpHI = ffb855e34e31
* rpBA = E1:B2:E3:BB:11:FF

From what I've gathered, this is what they mean:

* rpHA = Something related to HomeKit?
* rpHN = Discovery Nounce (6 bytes)
* rpVr = Likely protocol version
* rpMd = Device model name
* rpFl = Some status flags (or supported features)
* rpAD = Bonjour Auth Tag
* rpHI = Something else related to HomeKit
* rpBA = Bluetooth Address

Publishing this service will make a device appear in the list of selectable Apple TVs in the shortcuts app (tested via PoC). The shortcut app will also send data when trying to execute the action, so it seems to work as expected. At first I suspected that only IPv6 was supported for some reason, but IPv4 seems to work just fine as well.

This brings me no closer to a solution, but it at least shows that MRP is not used for this function so no need to spend any time on theory.

**Comment by postlund** [comment]
And another thing... This seems to be the same protocol that the Remote widget in action center is using. In the past that widget used MRP as I've been able to sniff traffic with the proxy, but maybe they switched in iOS 13 or so.

**Comment by lucasec** [comment]
I spent some time recently looking at some packet captures to better understand how companion and MRP fit together (since we know from logs they are both used by the control center widgets). Thought I'd drop a summary here—curious if this matches your observations to date.

I run a dual-stack network, so captured traffic destined to the Apple TV from both my iOS device's IPv4 and v6 addresses (more on why that's relevant later). The Apple TV was advertising the companion service at port 49152 and MRP at port 49153.

As soon as the iOS device connects to WiFi, it immediately went off and queried for `_companion-link._tcp`. It then opened a TCP connection to the apple TV's IPv4 address port 49152.

If I open the Now Playing widget in control center, the device then goes off and queries for `_airplay._tcp` and `_raop._tcp`. In this case, it decides to open a connection to the apple TV's IPv6 address on port 7000. The decision of what IP address family to use seems to be somewhat random, but companion tends to prefer IPv4 while AirPlay seems more often to prefer IPv6.

What's interesting is what follows—after exchanging a few messages over the AirPlay port, it then opens another TCP connection to the apple TV's IPv6 address on what appears to be a dynamically-bound port, in this case, 49303, but the port tends to change every time my iOS device drops off WiFi and re-connects. This is not advertised in mDNS anywhere, and because it re-uses the same address family as the AirPlay messages exchanged immediately prior, I think perhaps it's being derived out of the AirPlay protocol somewhere.

Using a few different functions on the device:

- Pressing any control on the Apple TV Remote control center widget generates traffic over companion protocol. This includes pressing buttons, touch input, and Siri. Dragging on the touch surface or holding down the Siri button generates short packets packets on the port at a regular interval, so it's pretty clear audio and HID event streaming is happening over companion.
- Activating various Apple TV Remote actions in the "Shortcuts" app generates traffic over companion protocol (including newer actions such as "skip content"). It doesn't seem to generate traffic over other ports. Configuring these actions in the Shortcuts app (e.g. when it discovers a list of launchable apps) also generates traffic over the companion port.
- Using controls in the now playing widget generates traffic on port 49303. The packet counts and sizes highly suggest this port is carrying MRP traffic.

I think we knew before that Apple had moved the remote widget functions over to the companion protocol. And that MRP was still used in some places since mediaremoted still generated activity on the device. What's new to me is that the MRP traffic appears to be sent over its own port (not tunneled inside companion protocol), and that it seems like the MRP port is somehow discovered over the AirPlay protocol.

**Comment by postlund** [comment]
As far as I have gathered, companion link is used for other services like handoff and continuity. A connection is more or less always active in order to act fast when something needs to be done. It is however almost always quiet as it seems to be directed in one way, but I can be wrong here.

The protocol itself (structure, OPACK and all that) is discussed and implemented in the open PR about companion link.

The relation, at its heart, is that Companion link is *much* more lightweight than MRP, thus more appropriate to have connected all the time. It creates a better user experience when opening the remote widget in control center as the connection is "already there". No additional delay, unless some kind of problem of course...

It supports a subset of features in MRP, like ordinary playback functions but also HID for the touch interface. It's basically a bridge as the receiver (on the Apple TV) repackages the requests and passes them over to mediaremoted via XPC. So it's not really it's own thing, it's just a different interface to mediaremoted just like MRP.

Regarding the additional port used for MRP, that's new to me. Maybe there's some exchange over companion link for that?

**Comment by lucasec** [comment]
Yep, I saw the PR a while back. Will definitely be interesting if you can get a proxy script to work. I didn't try looking at console on the Apple TV, but that's interesting that some actions seem to pass back to mediaremoted. I wonder if that holds with some of the newer actions (launch app, but also switch user, which seems to be new to tvOS 14 maybe?) though.

The port behavior is definitely interesting. I discovered this while trying to figure out how Music.app on my Mac connected to MRP. It appears to use similar behavior (conjures up a new port on every connection). A few logs I found on my Mac that seem interesting:

```
default	17:33:43.821738-0600	AirPlayXPCHelper	-FigRoutingManager- FigRoutingManagerInternal_HandlePickingRouteCallback: pickingRoute (0x7fed65325870) callback received DidReceiveDataFromCommChannel pickingRef 66762135843130
default	17:33:43.822062-0600	mediaremoted	<<<< AVOutputContext (FigRoutingContext) >>>> AVCommChannelDidReceiveData: called (commChannelUUID=500f7bb6-f55e-4634-a121-b2367eaf3bef, dataLength=193)
default	17:33:43.822128-0600	mediaremoted	<<<< AVOutputContext >>>> -[AVOutputContext outputContextImpl:didReceiveData:fromCommunicationChannel:]: Invoking -outputContext:didReceiveData:fromCommunicationChannel: with 193 bytes
default	17:33:43.822499-0600	mediaremoted	[AVIOStream] InputStream received 193 bytes from communication channel: <AVOutputContextCommunicationChannel: 0x7f9272c2cb40> - <MRAVInputStream:0x7f9272e14c90 outputContext = <AVOutputContext: 0x7f9272e077f0, ID=B59055D0-CF2C-4A1C-AC92-D92DC5504546, type=AVOutputContextTypeGroupControl>>
default	17:33:43.822738-0600	mediaremoted	[Message Received From <007885F6-D34A-4EF3-9DF5-7AA974A72637-<private>>]: 
<MRUpdateContentItemMessage, 
Message: REDACTED
>
```

That's not to say it couldn't be negotiated over companion protocol, but the timing and the fact that on the iOS device the IPv6 address class gets re-used (while the companion connection is using IPv4) is very interesting.

**Comment by mschwartz** [comment]
Sorry about the duplicate issue.  I'm looking forward to taking advantage of any new features.

I had opened a pyatv to MQTT bridge issue a while back.  I ended up doing it myself.  It's ugly because I'm not great at python (yet), but here's the repo: https://github.com/mschwartz/pyatv-microservice

Feel free to use it as you see fit.

Here's the MQTT output:
![2021-01-15 at 10 05 AM](https://user-images.githubusercontent.com/329637/104762488-4b0eeb80-5719-11eb-984f-d6bb42528b02.png)

Screenshot of the MQTT bridge in use:
![2021-01-15 at 10 09 AM](https://user-images.githubusercontent.com/329637/104762834-d9836d00-5719-11eb-965c-c17a0ef6f102.png)

Another screenshot
![2021-01-15 at 10 10 AM](https://user-images.githubusercontent.com/329637/104762869-ec963d00-5719-11eb-9a16-acd91b401cef.png)

When it is playing, the UI shows more interesting UI:

![2021-01-15 at 10 12 AM](https://user-images.githubusercontent.com/329637/104763093-3f6ff480-571a-11eb-82c3-b2c83a775707.png)

![2021-01-15 at 10 13 AM](https://user-images.githubusercontent.com/329637/104763129-4d257a00-571a-11eb-9a74-1ab7365ea57a.png)

What I don't get is complete information.  Like the show is app: Netflix, show: "Grey's Anatomy", episode: 'S6: E1: "Nothing Left to Cling To".  What I don't get is the show title (Grey's Anatomy).  Not sure if it is possible.

**Comment by postlund** [comment]
I just merged the protocol implementation (#657), which means I'm on my way to implement this. As I want testers fast, I will do things backwards and try to implement the interface first and then add fake device and tests. Lets see if I can prepare something. Let me know if you want to beta test 👍

**Comment by nehalvpatel** [comment]
I'm ready to test!

**Comment by postlund** [comment]
So... now I've pushed something that is testable in #1022. Please give it a spin and let me know! Instructions are in the PR.

**Comment by nehalvpatel** [comment]
Thanks, I'll be able to test it later today.

**Comment by EnzoQiu** [comment]
Dude, helps a lot. I had implemented a mdns proxy, encontered problem with this companion-link stuff, which seems like if I don't proxy _companion-link._tcp service-instance and only proxy _airplay._tcp service-instance packets, the Macbook embedded with airplay won't be founded by iphone on the screen mirroring  searching list. Your analysis really make sense.
