### ISSUE TITLE
Cannot detect Apple TV via Unicast

### ISSUE THREAD

**Issue by roflmao** [postlund/pyatv#363]
**Describe the bug**
Trying to add via Integrations i get this after typing the ip of the appletv:
https://www.jottacloud.com/s/00685b420db21ea49a5be1e61f2d4f1908b

**Logs**
```
2020-01-10 08:02:29 INFO (SyncWorker_0) [homeassistant.util.package] Attempting install of pyatv==0.4.0a11
2020-01-10 08:20:29 DEBUG (MainThread) [pyatv.udns] Sending DNS request to 192.168.66.77 (Data=35ff012000040000000000000b5f6170706c6574762d7632045f746370056c6f63616c0000ff00010b5f746f7563682d61626c65045f746370056c6f63616c0000ff00010e5f6d6564696172656d6f74657476045f746370056c6f63616c0000ff0001085f616972706c6179045f746370056c6f63616c0000ff0001)
```

**To Reproduce**
Click integrations, +, Apple TV, type IP, add.

**Expected behavior**
Detecting the AppleTV, this worked with the old iOS/pyatv implementation.

**System Setup (please complete the following information):**
 - OS: Ubuntu 18.04
 - Python: Python 3.7.6
 - Home Assistant 0.103.6 via docker
 - pyatv: 0.4.0a11

**Comment by postlund** [comment]
Is that really everything from the log? Relevant parts seems to be missing.

**Comment by roflmao** [comment]
There are no more related logs to pyatv im afraid.

**Comment by postlund** [comment]
Forget what I wrote, it is likely correct. Could you try `atvremote --scan-hosts 192.168.66.77 --debug scan` and see what you get?

**Comment by roflmao** [comment]
```
bash-5.0# atvremote --scan-hosts 192.168.66.77 --debug scan 
DEBUG: Sending DNS request to 192.168.66.77 (Data=35ff012000040000000000000b5f6170706c6574762d7632045f746370056c6f63616c0000ff00010b5f746f7563682d61626c65045f746370056c6f63616c0000ff00010e5f6d6564696172656d6f74657476045f746370056c6f63616c0000ff0001085f616972706c6179045f746370056c6f63616c0000ff0001)
Scan Results
========================================
bash-5.0# 
```

**Comment by postlund** [comment]
What Apple TV hardware is this btw?

**Comment by roflmao** [comment]
AppleTV 4K

**Comment by postlund** [comment]
Ok, interesting. But if you do `atvremote scan`, then it's found?

**Comment by roflmao** [comment]
Nope, i have another AppleTV which also is not found in either ways.
They are not on the same subnet as my Home Assistant, but i guessed with unicast this shouldnt be a problem.

**Comment by postlund** [comment]
Yeah, not being on the same subnet won't work for regular scanning. It should work with unicast but I honestly have not tested it that much. Can you try unicast scanning on a host that is on the same network as your devices?

**Comment by roflmao** [comment]
Installed pyatv==0.4.0a11 on a raspberry pi on the same subnet.
I dont get consistent output it seems:

```
root@rpi-zero:~# atvremote scan
Scan Results     
========================================
       Name: Soverommet
    Address: 192.168.69.117
Identifiers:
 - FD23ADB9-56D7-401C-8FC0-2014A245AFA5
 - 28:FF:3C:8E:B8:E9
Services:
 - Protocol: MRP, Port: 49152, Credentials: None
 - Protocol: AirPlay, Port: 7000, Credentials: None

root@rpi-zero:~# atvremote --scan-hosts 192.168.69.117 --debug scan
DEBUG: Sending DNS request to 192.168.69.117 (Data=35ff012000040000000000000b5f6170706c6574762d7632045f746370056c6f63616c0000ff00010b5f746f7563682d61626c65045f746370056c6f63616c0000ff00010e5f6d6564696172656d6f74657476045f746370056c6f63616c0000ff0001085f616972706c6179045f746370056c6f63616c0000ff0001)
Scan Results
========================================
root@rpi-zero:~# atvremote --scan-hosts 192.168.69.117 --debug scan
DEBUG: Sending DNS request to 192.168.69.117 (Data=35ff012000040000000000000b5f6170706c6574762d7632045f746370056c6f63616c0000ff00010b5f746f7563682d61626c65045f746370056c6f63616c0000ff00010e5f6d6564696172656d6f74657476045f746370056c6f63616c0000ff0001085f616972706c6179045f746370056c6f63616c0000ff0001)
Scan Results
========================================
root@rpi-zero:~# atvremote scan
Scan Results
========================================
root@rpi-zero:~# atvremote scan
Scan Results
========================================
       Name: Tv Stua
    Address: 192.168.69.102
Identifiers:
 - 00:05:4B:48:DD:64
Services:
 - Protocol: AirPlay, Port: 7000, Credentials: None

       Name: Soverommet
    Address: 192.168.69.117
Identifiers:
 - 28:FF:3C:8E:B8:E9
Services:
 - Protocol: AirPlay, Port: 7000, Credentials: None
```

**Comment by postlund** [comment]
Inconsistent output for regular scanning is "expected". It can happen for various reasons (see [this](https://postlund.github.io/pyatv//support/scanning_issues/) page). But it is worrying that unicast look ups doesn't work. Can't really tell why, would be interesting if an additional person could try as well.

**Comment by roflmao** [comment]
Roger that. Im available for debugging more when needed. Great job so far @postlund !

**Comment by postlund** [comment]
Great, thank you! 😄 

One thing that comes to mind, can you try this:

```shell
dig -p 5353 @192.168.69.117 _mediaremotetv._tcp.local. any
```

**Comment by postlund** [comment]
If the mentioned command works, it would be great with a packet dump (in hex is sufficient) of request and response if possible.

**Comment by roflmao** [comment]
No response im afraid:

```
root@rpi-zero:~# dig -p 5353 @192.168.66.77 _mediaremotetv._tcp.local. any

; <<>> DiG 9.10.3-P4-Raspbian <<>> -p 5353 @192.168.66.77 _mediaremotetv._tcp.local. any
; (1 server found)
;; global options: +cmd
;; connection timed out; no servers could be reached
root@rpi-zero:~# dig -p 5353 @192.168.69.117 _mediaremotetv._tcp.local. any

; <<>> DiG 9.10.3-P4-Raspbian <<>> -p 5353 @192.168.69.117 _mediaremotetv._tcp.local. any
; (1 server found)
;; global options: +cmd
;; connection timed out; no servers could be reached
root@rpi-zero:~# atvremote scan
Scan Results
========================================
       Name: Stua
    Address: 192.168.66.77
Identifiers:
 - DC:56:E7:3D:9B:C1
 - 380AA9DD-AA10-438A-A588-793688997019
Services:
 - Protocol: AirPlay, Port: 7000, Credentials: None
 - Protocol: MRP, Port: 49152, Credentials: None

       Name: Soverommet
    Address: 192.168.69.117
Identifiers:
 - 28:FF:3C:8E:B8:E9
 - FD23ADB9-56D7-401C-8FC0-2014A245AFA5
Services:
 - Protocol: AirPlay, Port: 7000, Credentials: None
 - Protocol: MRP, Port: 49152, Credentials: None

root@rpi-zero:~# atvremote scan
Scan Results
========================================
       Name: Stua
    Address: 192.168.66.77
Identifiers:
 - 380AA9DD-AA10-438A-A588-793688997019
 - DC:56:E7:3D:9B:C1
Services:
 - Protocol: MRP, Port: 49152, Credentials: None
 - Protocol: AirPlay, Port: 7000, Credentials: None

**Comment by postlund** [comment]
It is pretty weird, it "should" work... I did the same thing on my pi with the same version of `dig` and it worked like it should. Does it work if you send to multicast address like this:

```shell
dig -p 5353 @224.0.0.251 _mediaremotetv._tcp.local. any
```

**Comment by postlund** [comment]
Assuming the mDNS implementation is standards compliant in the Apple TV (which would be surprising if it isn't), it will not respond to requests from other subnets (see RFC6762 [here](https://tools.ietf.org/html/rfc6762#section-5.5)). One thought is... what interface does python pick and send request from? Maybe it relates somehow. Maybe you can check with wireshark or tcpdump? Should work with:

```shell
sudo tcpdump -vvv -n udp port 5353
```

Also, one more thing to try (that should be changed anyway) is to set the QU-bit (Question Unicast) in the request. Can you try to find `udns.py`, open it, look for this:

```python
def create_request(services):
    """Creste a new DnsMessage requesting specified services."""
    msg = DnsMessage(0x35Ff)
    msg.questions += [
        DnsQuestion(s, QTYPE_ANY, 0x0001) for s in services
    ]
    return msg.pack()
```

Change `0x0001` to `0x8001` and try again?

**Comment by roflmao** [comment]
Another pi of mine is getting an answer tho.
Both pi's are on the same subnet with no firewalling/iptables. 

```
root@rpi-rflink:~# dig -p 5353 @192.168.69.117 _mediaremotetv._tcp.local. any

; <<>> DiG 9.10.3-P4-Raspbian <<>> -p 5353 @192.168.69.117 _mediaremotetv._tcp.local. any
; (1 server found)
;; global options: +cmd
;; Got answer:
;; ->>HEADER<<- opcode: QUERY, status: NOERROR, id: 38197
;; flags: qr aa; QUERY: 1, ANSWER: 1, AUTHORITY: 0, ADDITIONAL: 5

;; QUESTION SECTION:
;_mediaremotetv._tcp.local.	IN	ANY

;; ANSWER SECTION:
_mediaremotetv._tcp.local. 10	IN	PTR	Soverommet._mediaremotetv._tcp.local.

;; ADDITIONAL SECTION:
Soverommet._mediaremotetv._tcp.local. 10 IN SRV	0 0 49152 Soverommet.local.
Soverommet._mediaremotetv._tcp.local. 10 IN TXT	"ModelName=Apple\194\160TV" "AllowPairing=YES" "BluetoothAddress=(\255<\148G\218" "macAddress=28:ff:3c:8e:b8:e9" "Name=Soverommet" "UniqueIdentifier=FD23ADB9-56D7-401C-8FC0-2014A245AFA5" "SystemBuildVersion=17K449" "LocalAirPlayReceiverPairingIdentity=ECC1982C-C7DB-44BA-AE1C-878DE685F838"
Soverommet._device-info._tcp.local. 10 IN TXT	"model=J42dAP"
Soverommet.local.	10	IN	AAAA	fe80::879:74b8:542c:52d4
Soverommet.local.	10	IN	A	192.168.69.117

;; Query time: 7 msec
;; SERVER: 192.168.69.117#5353(192.168.69.117)
;; WHEN: Fri Jan 10 15:19:22 CET 2020
;; MSG SIZE  rcvd: 463
```

And scanning the host:
```
root@rpi-rflink:~# atvremote --scan-hosts 192.168.69.117 --debug scan
DEBUG: Sending DNS request to 192.168.69.117 (Data=35ff012000040000000000000b5f6170706c6574762d7632045f746370056c6f63616c0000ff00010b5f746f7563682d61626c65045f746370056c6f63616c0000ff00010e5f6d6564696172656d6f74657476045f746370056c6f63616c0000ff0001085f616972706c6179045f746370056c6f63616c0000ff0001)
DEBUG: Received DNS response from 192.168.69.117 (Data=35ff840000020002000000070e5f6d6564696172656d6f74657476045f746370056c6f63616c0000ff0001085f616972706c6179c01b00ff0001c00c000c00010000000a000d0a536f7665726f6d6d6574c00cc02b000c00010000000a000d0a536f7665726f6d6d6574c02bc046002100010000000a001300000000c0000a536f7665726f6d6d6574c020c046001000010000000a0103134d6f64656c4e616d653d4170706c65c2a0545610416c6c6f7750616972696e673d59455317426c7565746f6f7468416464726573733d28ff3c9447da1c6d6163416464726573733d32383a66663a33633a38653a62383a65390f4e616d653d536f7665726f6d6d657435556e697175654964656e7469666965723d46443233414442392d353644372d343031432d384643302d3230313441323435414641351953797374656d4275696c6456657273696f6e3d31374b343439484c6f63616c416972506c6179526563656976657250616972696e674964656e746974793d45434331393832432d433744422d343442412d414531432d3837384445363835463833380a536f7665726f6d6d65740c5f6465766963652d696e666fc01b001000010000000a000d0c6d6f64656c3d4a3432644150c05f002100010000000a0008000000001b58c07ec05f001000010000000a01700561636c3d30186274616464723d32383a46463a33433a39343a34373a44411a64657669636569643d32383a46463a33433a38453a42383a45391e66656174757265733d307835413746464646372c307833433135354644450d666c6167733d30783130363434286769643d38334339443135452d313035382d344142462d423634352d3545393536383344363841390569676c3d31066763676c3d31106d6f64656c3d4170706c655456352c330d70726f746f766572733d312e312770693d64336338376562332d326163642d346539652d386565382d663632636438383538333539287073693d45434331393832432d433744422d343442412d414531432d38373844453638354638333843706b3d323831313039656562306635373538363865633166656464623362316164333864306463383365626236363161643439323339636531303639656463366435370d737263766572733d3431352e330b6f73766572733d31332e330476763d32c07e001c00010000000a0010fe80000000000000087974b8542c52d4c07e000100010000000a0004c0a84575)
DEBUG: Auto-discovered Soverommet at 192.168.69.117:49152 (Protocol.MRP)
DEBUG: Auto-discovered Soverommet at 192.168.69.117:7000 (Protocol.AirPlay)
Scan Results
========================================
       Name: Soverommet
    Address: 192.168.69.117
Identifiers:
 - 28:FF:3C:8E:B8:E9
 - FD23ADB9-56D7-401C-8FC0-2014A245AFA5
Services:
 - Protocol: AirPlay, Port: 7000, Credentials: None
 - Protocol: MRP, Port: 49152, Credentials: None
```

**Comment by postlund** [comment]
This makes it even more interesting. Is there any difference between the two that you can think of? Sniffing the traffic to see if it leaves the device and if the response arrives but is filtered somewhere seems to be a good next step.

**Comment by stp6778** [comment]
I've noticed the AppleTV cannot be detect after sending the "suspend" command and a media_player.turn_off.

**Comment by postlund** [comment]
> I've noticed the AppleTV cannot be detect after sending the "suspend" command and a media_player.turn_off.

Yes, the suspend is a bit tricky that way. You have to be aware of that when using it. Should probably document that.

**Comment by postlund** [comment]
@roflmao Have made any progress here finding the source? I'm trying to finish off bug reports for 0.4.0 as I'm getting closer to release, so just want to get the ball rolling.

**Comment by roflmao** [comment]
I think this may be a mix of buggy mdns setup in my network. Avahi in my pfsense router seems buggy since my iOS appletv app fails to detect my appletv on another subnet as well. 
I can ping my appletvs but the dnsrequests against port 5353 just times out. 

Ill be glad to test pure unicast if you have some pointers. Are unicast requests still dependant on mDNS?

**Comment by postlund** [comment]
In that case I believe there's filtering going on somewhere. When you specify `--scan-hosts` to `atvremote` you use unicast scanning (which is more or less the same as regular, but you don't send the request to a multicast address). The dig command would correspond to the same thing as well.

I would have a look at potential firewall rules and also dump network traffic with wireshark/tcpdump from another host on the same network to see if the request leaves the pi and if a response is seen from the Apple TV at all.

**Comment by roflmao** [comment]
Does ATVs filter anything? I dont get anything back from my appletv on another subnet:

```
root@rpi-rflink:~# tcpdump -i any udp and host 192.168.66.77
tcpdump: verbose output suppressed, use -v or -vv for full protocol decode
listening on any, link-type LINUX_SLL (Linux cooked), capture size 262144 bytes

21:41:40.591183 IP rpi-rflink.intra.42163 > Stua.intra.mdns: 13823+ [4q] ANY (QU)? _appletv-v2._tcp.local. ANY (QU)? _touch-able._tcp.local. ANY (QU)? _mediaremotetv._tcp.local. ANY (QU)? _airplay._tcp.local. (124)
21:41:47.120833 IP rpi-rflink.intra.37307 > Stua.intra.mdns: 27609+ [1au] ANY (QM)? _mediaremotetv._tcp.local. (54)
21:41:52.120051 IP rpi-rflink.intra.37307 > Stua.intra.mdns: 27609+ [1au] ANY (QM)? _mediaremotetv._tcp.local. (54)
21:41:57.120233 IP rpi-rflink.intra.37307 > Stua.intra.mdns: 27609+ [1au] ANY (QM)? _mediaremotetv._tcp.local. (54)
```

These packets created by:

```
root@rpi-rflink:~# atvremote --scan-hosts 192.168.66.77 --debug scan
DEBUG: Sending DNS request to 192.168.66.77 (Data=35ff012000040000000000000b5f6170706c6574762d7632045f746370056c6f63616c0000ff80010b5f746f7563682d61626c65045f746370056c6f63616c0000ff80010e5f6d6564696172656d6f74657476045f746370056c6f63616c0000ff8001085f616972706c6179045f746370056c6f63616c0000ff8001)
Scan Results
========================================
root@rpi-rflink:~# dig -p 5353 @192.168.66.77 _mediaremotetv._tcp.local. any

; <<>> DiG 9.10.3-P4-Raspbian <<>> -p 5353 @192.168.66.77 _mediaremotetv._tcp.local. any
; (1 server found)
;; global options: +cmd
;; connection timed out; no servers could be reached
root@rpi-rflink:~#
```

**Comment by postlund** [comment]
As long as it follows the multicast DNS specification it will silently drop everything with a source address outside its own subnet. So you cannot do cross-subnet requests unless you NAT the traffic to change the source address in transit.

From 5.5 in [RFC7672](https://tools.ietf.org/html/rfc6762#section-5.5):
```
Since it is possible for a unicast query to be received from a machine
outside the local link, responders SHOULD check that the source
address in the query packet matches the local subnet for that link (or,
in the case of IPv6, the source address has an on-link prefix) and
silently ignore the packet if not.
```

**Comment by postlund** [comment]
@roflmao Have you gotten any wiser on the situation?

**Comment by roflmao** [comment]
@postlund Since i run multiple subnets plus an overlay network in k8s which doesnt support multicast i guess i cannot be of much help

**Comment by postlund** [comment]
@roflmao I guess that is quite a special setup. But the pi that doesn't work, is that on the same subnet as the Apple TV or not? If it's not, then I feel that we can close this issue because it is expected behavior. Perhaps not desired, but expected.

**Comment by roflmao** [comment]
It is not on the same subnet im afraid. Closing:\
