### ISSUE TITLE
[beta] Cannot connect to apple TV

### ISSUE THREAD

**Issue by simonszu** [postlund/pyatv#575]
**Describe the bug**

I have Home Assistant in a docker container and an Apple TV 4K 64GB. The beta of the new integration is not able to connect to the AppleTV. Home sharing is enabled on the ATV.

**To Reproduce**

Install beta repo from HACS, add a new ATV. No devices found, of course, the docker container is in its own subnet. Specify the IP address manually. Result: "Device could not be found on the network. Please try again"

**Expected behavior**

**System Setup (please complete the following information):**
 - OS: Debian via Docker, official Home Assistant container image
 - Python: 3.7.7
 - pyatv: 0.5.0 update 4
- Apple TV:  Apple TV 4K tvOS 13.4

**Additional context**

Debug log:
```
2020-04-14 16:10:15 DEBUG (MainThread) [pyatv] Discovering devices for 3 seconds
2020-04-14 16:10:18 DEBUG (MainThread) [pyatv] Discovering devices for 3 seconds
2020-04-14 16:10:29 DEBUG (MainThread) [pyatv.support.udns] Sending DNS request to 192.168.12.8 (Data=35ff012000040000000000000b5f6170706c6574762d7632045f746370056c6f63616c0000ff80010b5f746f7563682d61626c65045f746370056c6f63616c0000ff80010e5f6d6564696172656d6f74657476045f746370056c6f63616c0000ff8001085f616972706c6179045f746370056c6f63616c0000ff8001)
2020-04-14 16:10:32 DEBUG (MainThread) [pyatv] Discovering devices for 3 seconds
```

**Comment by postlund** [comment]
I've had this problem too, seems to be something with docker from what I can tell (but not really managed to solve it). Are you running with network in host mode?

**Comment by simonszu** [comment]
No, i am not. I was able to get all other integrations running with dedicated network mode, especially pyHomematic, which had an option to specify the docker host's IP for callback traffic. Maybe that's a similar issue here? However, docker should properly NAT even this DNS request, shouldn't it? But i heard about Docker having problems with UDP since ever.

**Comment by postlund** [comment]
Yeah, I got the feeling that docker and UDP is not a good combo. It would be interesting to capture the traffic leaving your computer with tcpdump or wireshark, just to see what is in the packets and if a response is returned at all. If you could do that it would be great. UDP port 5353 is a good filter.

**Comment by bramhendriks** [comment]
Hi Postlund, 

i have the same issue. Used some time to capture some packets to see what traffic is flowing. Unfortunatly i only see the request from the HASSIO server to the apple-tv, but no response.

My network is setup as discribed below:
HassIO Ubuntu VM: 10.10.10.11:8123
AppleTV: 10.10.50.201
Router: Ubiquity Edgerouter-X with vlans per switch.

I've executed a ping to test connectivity. This is ok and i get a ping reply. So end-to-end connectivity is OK. No firewall is in place.

**Logging from home assistant log (Debug pyatv):**
```
2020-04-15 14:45:16 DEBUG (MainThread) [pyatv.support.udns] Sending DNS request to 10.10.50.201 (Data=35ff012000040000000000000b5f6170706c6574762d7632045f746370056c6f63616c0000ff80010b5f746f7563682d61626c65045f746370056c6f63616c0000ff80010e5f6d6564696172656d6f74657476045f746370056c6f63616c0000ff8001085f616972706c6179045f746370056c6f63616c0000ff8001)
2020-04-15 14:45:19 DEBUG (MainThread) [pyatv] Discovering devices for 3 seconds
```

**Packet capture from HassIO server**
First you see 2x a echo request following an echy reply.
```
bramhendriks@hassio:~$ sudo tcpdump -i eth0 -nn host 10.10.50.201
tcpdump: verbose output suppressed, use -v or -vv for full protocol decode
listening on eth0, link-type EN10MB (Ethernet), capture size 262144 bytes
12:45:13.812851 IP 10.10.10.11 > 10.10.50.201: ICMP echo request, id 12738, seq 1, length 64
12:45:13.814832 IP 10.10.50.201 > 10.10.10.11: ICMP echo reply, id 12738, seq 1, length 64
12:45:14.814086 IP 10.10.10.11 > 10.10.50.201: ICMP echo request, id 12738, seq 2, length 64
12:45:14.817152 IP 10.10.50.201 > 10.10.10.11: ICMP echo reply, id 12738, seq 2, length 64
12:45:16.564507 IP 10.10.10.11.54832 > 10.10.50.201.5353: 13823+ [4q] ANY (QU)? _appletv-v2._tcp.local. ANY (QU)? _touch-able._tcp.local. ANY (QU)? _mediaremotetv._tcp.local. ANY (QU)? _airplay._tcp.local. (124)
```

**Packet capture from Ubiquiti router (routping point for the network)**
```
administrator@ubnt:~$ sudo tcpdump -n host 10.10.50.201
tcpdump: verbose output suppressed, use -v or -vv for full protocol decode
listening on switch0, link-type EN10MB (Ethernet), capture size 262144 bytes
12:45:13.810310 IP 10.10.10.11 > 10.10.50.201: ICMP echo request, id 12738, seq 1, length 64
12:45:13.811769 IP 10.10.50.201 > 10.10.10.11: ICMP echo reply, id 12738, seq 1, length 64
12:45:14.811849 IP 10.10.10.11 > 10.10.50.201: ICMP echo request, id 12738, seq 2, length 64
12:45:14.813991 IP 10.10.50.201 > 10.10.10.11: ICMP echo reply, id 12738, seq 2, length 64
12:45:16.562027 IP 10.10.10.11.54832 > 10.10.50.201.5353: 13823+ [4q] ANY (QU)? _appletv-v2._tcp.local. ANY (QU)? _touch-able    ._tcp.local. ANY (QU)? _mediaremotetv._tcp.local. ANY (QU)? _airplay._tcp.local. (124)
```

Will add the Apple TV to the same layer 2 subnet as the server (10.10.10.x) to see what will happen next. Will update the post when i gathered the information.

**Comment by postlund** [comment]
@bramhendriks Hi! Thanks for the logs. The devices must be on the same subnet for this to work, the Apple TV will drop packets originating from other subnets, see 5.5 in [RFC7672](https://tools.ietf.org/html/rfc6762#section-5.5):

```
Since it is possible for a unicast query to be received from a machine
outside the local link, responders SHOULD check that the source
address in the query packet matches the local subnet for that link (or,
in the case of IPv6, the source address has an on-link prefix) and
silently ignore the packet if not.
```

**Comment by postlund** [comment]
Oh, I missed the fact that the original post mentioned that the docker container is in its own subnet. That is probably why this doesn't work as well.

**Comment by postlund** [comment]
So, I created a new issue, #581, to raise an exception if unicast scanning is performed on an address outside of any local subnet to the host. This should make it more obvious when trying to do so. I'll see when I get time to implement it. It would still be good if you tried the same thing, but put the Apple TV(s) in the same subnet as Home Assistant.

**Comment by bramhendriks** [comment]
@postlund Thanks for that link. That explains a lot. I did a new attempt with the apple-TV in the same subnet as the hassio server, this was successfull, see the logs below of the tcpdump:

**TCP dump logs**
```
bramhendriks@hassio:~$ sudo tcpdump -i eth0 -nn host 10.10.10.201
tcpdump: verbose output suppressed, use -v or -vv for full protocol decode
listening on eth0, link-type EN10MB (Ethernet), capture size 262144 bytes
13:37:35.421343 IP 10.10.10.11 > 10.10.10.201: ICMP echo request, id 12904, seq 1, length 64
13:37:35.423999 IP 10.10.10.201 > 10.10.10.11: ICMP echo reply, id 12904, seq 1, length 64
13:37:36.423153 IP 10.10.10.11 > 10.10.10.201: ICMP echo request, id 12904, seq 2, length 64
13:37:36.426012 IP 10.10.10.201 > 10.10.10.11: ICMP echo reply, id 12904, seq 2, length 64
13:37:40.458577 IP 10.10.10.201.5353 > 224.0.0.251.5353: 0*- [0q] 6/0/0 PTR _sleep-proxy._udp.local., PTR _mediaremotetv._tcp.local., PTR _airplay._tcp.local., PTR _raop._tcp.local., PTR _companion-link._tcp.local., PTR _homekit._tcp.local. (197)
13:37:41.831377 IP 10.10.10.201.5353 > 224.0.0.251.5353: 0 [6a] [7q] PTR (QM)? _companion-link._tcp.local. PTR (QM)? _hap._tcp.local. PTR (QM)? _homekit._tcp.local. TXT (QM)? 5FD9B5D9-8436-53B2-84E1-E21E67E7BE03._homekit._tcp.local. PTR (QM)? _raop._tcp.local. PTR (QM)? _airplay._tcp.local. PTR (QM)? _sleep-proxy._udp.local. (337)
13:37:41.935923 IP 10.10.10.201.5353 > 224.0.0.251.5353: 0*- [0q] 1/0/1 (Cache flush) TXT "si=B05414CF-0031-42FF-94D4-DB482933889B" (141)
13:37:58.521809 IP 10.10.10.201.5353 > 224.0.0.251.5353: 0*- [0q] 1/0/6 PTR 5FD9B5D9-8436-53B2-84E1-E21E67E7BE03._homekit._tcp.local. (249)
13:38:00.224993 IP 10.10.10.201.5353 > 224.0.0.251.5353: 0*- [0q] 3/0/9 PTR Woonkamer._mediaremotetv._tcp.local., TXT "model=J42dAP", PTR Woonkamer._airplay._tcp.local. (947)
13:38:06.519360 IP 10.10.10.201.5353 > 224.0.0.251.5353: 0*- [0q] 1/0/6 PTR 70-35-60-63.1 Woonkamer._sleep-proxy._udp.local. (201)
13:38:14.538472 IP 10.10.10.201.5353 > 224.0.0.251.5353: 0*- [0q] 2/0/6 PTR Woonkamer._mediaremotetv._tcp.local., TXT "model=J42dAP" (494)
13:38:18.903985 IP 10.10.10.11.51172 > 10.10.10.201.49153: Flags [S], seq 93282055, win 64240, options [mss 1460,sackOK,TS val 1100600457 ecr 0,nop,wscale 7], length 0
13:38:18.907158 IP 10.10.10.201.49153 > 10.10.10.11.51172: Flags [S.], seq 717157710, ack 93282056, win 65535, options [mss 1460,nop,wscale 6,nop,nop,TS val 1885657528 ecr 1100600457,sackOK,eol], length 0
13:38:18.907331 IP 10.10.10.11.51172 > 10.10.10.201.49153: Flags [.], ack 1, win 502, options [nop,nop,TS val 1100600460 ecr 1885657528], length 0
13:38:18.909002 IP 10.10.10.201.49153 > 10.10.10.11.51172: Flags [.], ack 1, win 2058, options [nop,nop,TS val 1885657529 ecr 1100600460], length 0
13:38:18.932870 IP 10.10.10.11.51172 > 10.10.10.201.49153: Flags [P.], seq 1:180, ack 1, win 502, options [nop,nop,TS val 1100600486 ecr 1885657529], length 179
13:38:18.934831 IP 10.10.10.201.49153 > 10.10.10.11.51172: Flags [.], ack 180, win 2056, options [nop,nop,TS val 1885657554 ecr 1100600486], length 0
13:38:18.936728 IP 10.10.10.201.49153 > 10.10.10.11.51172: Flags [P.], seq 1:362, ack 180, win 2056, options [nop,nop,TS val 1885657555 ecr 1100600486], length 361
13:38:18.936747 IP 10.10.10.11.51172 > 10.10.10.201.49153: Flags [.], ack 362, win 501, options [nop,nop,TS val 1100600489 ecr 1885657555], length 0
13:38:18.938898 IP 10.10.10.11.51172 > 10.10.10.201.49153: Flags [P.], seq 180:204, ack 362, win 501, options [nop,nop,TS val 1100600492 ecr 1885657555], length 24
13:38:18.940657 IP 10.10.10.201.49153 > 10.10.10.11.51172: Flags [.], ack 204, win 2055, options [nop,nop,TS val 1885657558 ecr 1100600492], length 0
13:38:19.058598 IP 10.10.10.201.49153 > 10.10.10.11.51172: Flags [P.], seq 362:792, ack 204, win 2055, options [nop,nop,TS val 1885657675 ecr 1100600492], length 430
13:38:19.100910 IP 10.10.10.11.51172 > 10.10.10.201.49153: Flags [.], ack 792, win 501, options [nop,nop,TS val 1100600654 ecr 1885657675], length 0
13:38:22.681321 IP 10.10.10.201.5353 > 224.0.0.251.5353: 0*- [0q] 2/0/6 TXT "model=J42dAP", PTR Woonkamer._airplay._tcp.local. (597)
13:38:24.152957 ARP, Request who-has 10.10.10.201 tell 10.10.10.11, length 28
13:38:24.154967 ARP, Reply 10.10.10.201 is-at 04:4b:ed:b0:97:c3, length 46
13:38:25.258784 IP 10.10.10.11.51172 > 10.10.10.201.49153: Flags [P.], seq 204:682, ack 792, win 501, options [nop,nop,TS val 1100606811 ecr 1885657675], length 478
13:38:25.260735 IP 10.10.10.201.49153 > 10.10.10.11.51172: Flags [.], ack 682, win 2048, options [nop,nop,TS val 1885663872 ecr 1100606811], length 0
13:38:25.344394 IP 10.10.10.201.49153 > 10.10.10.11.51172: Flags [P.], seq 792:879, ack 682, win 2048, options [nop,nop,TS val 1885663955 ecr 1100606811], length 87
13:38:25.344424 IP 10.10.10.11.51172 > 10.10.10.201.49153: Flags [.], ack 879, win 501, options [nop,nop,TS val 1100606897 ecr 1885663955], length 0
13:38:25.350489 IP 10.10.10.11.51172 > 10.10.10.201.49153: Flags [P.], seq 682:862, ack 879, win 501, options [nop,nop,TS val 1100606903 ecr 1885663955], length 180
13:38:25.352767 IP 10.10.10.201.49153 > 10.10.10.11.51172: Flags [.], ack 862, win 2045, options [nop,nop,TS val 1885663963 ecr 1100606903], length 0
13:38:25.367561 IP 10.10.10.201.49153 > 10.10.10.11.51172: Flags [P.], seq 879:1059, ack 862, win 2048, options [nop,nop,TS val 1885663977 ecr 1100606903], length 180
13:38:25.372062 IP 10.10.10.11.51172 > 10.10.10.201.49153: Flags [F.], seq 862, ack 1059, win 501, options [nop,nop,TS val 1100606925 ecr 1885663977], length 0
13:38:25.372358 IP 10.10.10.11.57570 > 10.10.10.201.7000: Flags [S], seq 804716714, win 64240, options [mss 1460,sackOK,TS val 1100606925 ecr 0,nop,wscale 7], length 0
13:38:25.374610 IP 10.10.10.201.49153 > 10.10.10.11.51172: Flags [.], ack 863, win 2048, options [nop,nop,TS val 1885663984 ecr 1100606925], length 0
13:38:25.374645 IP 10.10.10.201.7000 > 10.10.10.11.57570: Flags [S.], seq 2326290392, ack 804716715, win 65535, options [mss 1460,nop,wscale 6,nop,nop,TS val 1885663984 ecr 1100606925,sackOK,eol], length 0
13:38:25.374665 IP 10.10.10.11.57570 > 10.10.10.201.7000: Flags [.], ack 1, win 502, options [nop,nop,TS val 1100606927 ecr 1885663984], length 0
13:38:25.375328 IP 10.10.10.11.57570 > 10.10.10.201.7000: Flags [P.], seq 1:215, ack 1, win 502, options [nop,nop,TS val 1100606928 ecr 1885663984], length 214
13:38:25.376454 IP 10.10.10.201.7000 > 10.10.10.11.57570: Flags [.], ack 1, win 2058, options [nop,nop,TS val 1885663985 ecr 1100606927], length 0
13:38:25.376463 IP 10.10.10.201.7000 > 10.10.10.11.57570: Flags [.], ack 215, win 2055, options [nop,nop,TS val 1885663985 ecr 1100606928], length 0
13:38:25.382196 IP 10.10.10.201.7000 > 10.10.10.11.57570: Flags [P.], seq 1:101, ack 215, win 2055, options [nop,nop,TS val 1885663990 ecr 1100606928], length 100
13:38:25.382226 IP 10.10.10.11.57570 > 10.10.10.201.7000: Flags [.], ack 101, win 502, options [nop,nop,TS val 1100606935 ecr 1885663990], length 0
13:38:30.590913 IP 10.10.10.201.5353 > 224.0.0.251.5353: 0*- [0q] 1/0/6 PTR 044BEDB097C3@Woonkamer._raop._tcp.local. (384)
13:38:30.875839 IP 10.10.10.11.57570 > 10.10.10.201.7000: Flags [P.], seq 215:438, ack 101, win 502, options [nop,nop,TS val 1100612428 ecr 1885663990], length 223
13:38:30.876160 IP 10.10.10.11.57570 > 10.10.10.201.7000: Flags [P.], seq 438:523, ack 101, win 502, options [nop,nop,TS val 1100612429 ecr 1885663990], length 85
13:38:30.878835 IP 10.10.10.201.7000 > 10.10.10.11.57570: Flags [.], ack 438, win 2052, options [nop,nop,TS val 1885669484 ecr 1100612428], length 0
13:38:30.878851 IP 10.10.10.201.7000 > 10.10.10.11.57570: Flags [.], ack 523, win 2050, options [nop,nop,TS val 1885669484 ecr 1100612429], length 0
13:38:30.983101 IP 10.10.10.201.7000 > 10.10.10.11.57570: Flags [P.], seq 101:593, ack 523, win 2050, options [nop,nop,TS val 1885669588 ecr 1100612429], length 492
13:38:30.983131 IP 10.10.10.11.57570 > 10.10.10.201.7000: Flags [.], ack 593, win 501, options [nop,nop,TS val 1100612536 ecr 1885669588], length 0
13:38:30.993124 IP 10.10.10.11.57570 > 10.10.10.201.7000: Flags [P.], seq 523:747, ack 593, win 501, options [nop,nop,TS val 1100612546 ecr 1885669588], length 224
13:38:30.993424 IP 10.10.10.11.57570 > 10.10.10.201.7000: Flags [P.], seq 747:1094, ack 593, win 501, options [nop,nop,TS val 1100612546 ecr 1885669588], length 347
13:38:30.994763 IP 10.10.10.201.7000 > 10.10.10.11.57570: Flags [.], ack 747, win 2047, options [nop,nop,TS val 1885669598 ecr 1100612546], length 0
13:38:30.994776 IP 10.10.10.201.7000 > 10.10.10.11.57570: Flags [.], ack 1094, win 2041, options [nop,nop,TS val 1885669598 ecr 1100612546], length 0
13:38:31.078132 IP 10.10.10.201.7000 > 10.10.10.11.57570: Flags [P.], seq 593:817, ack 1094, win 2048, options [nop,nop,TS val 1885669681 ecr 1100612546], length 224
13:38:31.080961 IP 10.10.10.11.57570 > 10.10.10.201.7000: Flags [P.], seq 1094:1318, ack 817, win 501, options [nop,nop,TS val 1100612634 ecr 1885669681], length 224
13:38:31.081364 IP 10.10.10.11.57570 > 10.10.10.201.7000: Flags [P.], seq 1318:1434, ack 817, win 501, options [nop,nop,TS val 1100612634 ecr 1885669681], length 116
13:38:31.082543 IP 10.10.10.201.7000 > 10.10.10.11.57570: Flags [.], ack 1318, win 2044, options [nop,nop,TS val 1885669685 ecr 1100612634], length 0
13:38:31.082562 IP 10.10.10.201.7000 > 10.10.10.11.57570: Flags [.], ack 1434, win 2042, options [nop,nop,TS val 1885669685 ecr 1100612634], length 0
13:38:31.120821 IP 10.10.10.201.7000 > 10.10.10.11.57570: Flags [P.], seq 817:1083, ack 1434, win 2048, options [nop,nop,TS val 1885669722 ecr 1100612634], length 266
13:38:31.149149 IP 10.10.10.11.34262 > 10.10.10.201.5353: 13823+ [4q] ANY (QU)? _appletv-v2._tcp.local. ANY (QU)? _touch-able._tcp.local. ANY (QU)? _mediaremotetv._tcp.local. ANY (QU)? _airplay._tcp.local. (124)
13:38:31.153052 IP 10.10.10.201.5353 > 10.10.10.11.34262: 13823*- [2q], 2/0/7 PTR Woonkamer._mediaremotetv._tcp.local., PTR Woonkamer._airplay._tcp.local. (897)
13:38:31.164967 IP 10.10.10.11.57570 > 10.10.10.201.7000: Flags [.], ack 1083, win 501, options [nop,nop,TS val 1100612718 ecr 1885669722], length 0
13:38:31.182308 IP 10.10.10.11.51182 > 10.10.10.201.49153: Flags [S], seq 4256786359, win 64240, options [mss 1460,sackOK,TS val 1100612735 ecr 0,nop,wscale 7], length 0
13:38:31.184824 IP 10.10.10.201.49153 > 10.10.10.11.51182: Flags [S.], seq 1247971935, ack 4256786360, win 65535, options [mss 1460,nop,wscale 6,nop,nop,TS val 1885669784 ecr 1100612735,sackOK,eol], length 0
13:38:31.184851 IP 10.10.10.11.51182 > 10.10.10.201.49153: Flags [.], ack 1, win 502, options [nop,nop,TS val 1100612738 ecr 1885669784], length 0
13:38:31.186585 IP 10.10.10.201.49153 > 10.10.10.11.51182: Flags [.], ack 1, win 2058, options [nop,nop,TS val 1885669785 ecr 1100612738], length 0
13:38:31.188438 IP 10.10.10.11.51182 > 10.10.10.201.49153: Flags [P.], seq 1:180, ack 1, win 502, options [nop,nop,TS val 1100612741 ecr 1885669785], length 179
13:38:31.190435 IP 10.10.10.201.49153 > 10.10.10.11.51182: Flags [.], ack 180, win 2056, options [nop,nop,TS val 1885669788 ecr 1100612741], length 0
13:38:31.194807 IP 10.10.10.201.49153 > 10.10.10.11.51182: Flags [P.], seq 1:362, ack 180, win 2056, options [nop,nop,TS val 1885669791 ecr 1100612741], length 361
13:38:31.194818 IP 10.10.10.11.51182 > 10.10.10.201.49153: Flags [.], ack 362, win 501, options [nop,nop,TS val 1100612747 ecr 1885669791], length 0
13:38:31.200328 IP 10.10.10.11.51182 > 10.10.10.201.49153: Flags [P.], seq 180:235, ack 362, win 501, options [nop,nop,TS val 1100612753 ecr 1885669791], length 55
13:38:31.202403 IP 10.10.10.201.49153 > 10.10.10.11.51182: Flags [.], ack 235, win 2055, options [nop,nop,TS val 1885669797 ecr 1100612753], length 0
13:38:31.208992 IP 10.10.10.201.49153 > 10.10.10.11.51182: Flags [P.], seq 362:542, ack 235, win 2055, options [nop,nop,TS val 1885669803 ecr 1100612753], length 180
13:38:31.211367 IP 10.10.10.11.51182 > 10.10.10.201.49153: Flags [P.], seq 235:380, ack 542, win 501, options [nop,nop,TS val 1100612764 ecr 1885669803], length 145
13:38:31.212423 IP 10.10.10.201.49153 > 10.10.10.11.51182: Flags [.], ack 380, win 2052, options [nop,nop,TS val 1885669806 ecr 1100612764], length 0
13:38:31.218782 IP 10.10.10.201.49153 > 10.10.10.11.51182: Flags [P.], seq 542:563, ack 380, win 2052, options [nop,nop,TS val 1885669812 ecr 1100612764], length 21
13:38:31.220905 IP 10.10.10.11.51182 > 10.10.10.201.49153: Flags [P.], seq 380:406, ack 563, win 501, options [nop,nop,TS val 1100612774 ecr 1885669812], length 26
13:38:31.221996 IP 10.10.10.11.51182 > 10.10.10.201.49153: Flags [P.], seq 406:438, ack 563, win 501, options [nop,nop,TS val 1100612775 ecr 1885669812], length 32
13:38:31.222396 IP 10.10.10.201.49153 > 10.10.10.11.51182: Flags [.], ack 406, win 2052, options [nop,nop,TS val 1885669815 ecr 1100612774], length 0
13:38:31.223117 IP 10.10.10.11.51182 > 10.10.10.201.49153: Flags [P.], seq 438:497, ack 563, win 501, options [nop,nop,TS val 1100612776 ecr 1885669815], length 59
13:38:31.224330 IP 10.10.10.201.49153 > 10.10.10.11.51182: Flags [.], ack 438, win 2052, options [nop,nop,TS val 1885669816 ecr 1100612775], length 0
13:38:31.224339 IP 10.10.10.201.49153 > 10.10.10.11.51182: Flags [.], ack 497, win 2051, options [nop,nop,TS val 1885669816 ecr 1100612776], length 0
13:38:31.249826 IP 10.10.10.201.49153 > 10.10.10.11.51182: Flags [.], seq 563:2011, ack 497, win 2051, options [nop,nop,TS val 1885669840 ecr 1100612776], length 1448
13:38:31.249904 IP 10.10.10.201.49153 > 10.10.10.11.51182: Flags [.], seq 2011:3459, ack 497, win 2051, options [nop,nop,TS val 1885669840 ecr 1100612776], length 1448
13:38:31.249978 IP 10.10.10.201.49153 > 10.10.10.11.51182: Flags [.], seq 3459:4907, ack 497, win 2051, options [nop,nop,TS val 1885669840 ecr 1100612776], length 1448
13:38:31.250068 IP 10.10.10.201.49153 > 10.10.10.11.51182: Flags [P.], seq 4907:5839, ack 497, win 2051, options [nop,nop,TS val 1885669840 ecr 1100612776], length 932
13:38:31.250216 IP 10.10.10.11.51182 > 10.10.10.201.49153: Flags [.], ack 5839, win 501, options [nop,nop,TS val 1100612803 ecr 1885669840], length 0
13:38:31.259567 IP 10.10.10.201.49153 > 10.10.10.11.51182: Flags [P.], seq 5839:5921, ack 497, win 2051, options [nop,nop,TS val 1885669849 ecr 1100612803], length 82
13:38:31.300872 IP 10.10.10.11.51182 > 10.10.10.201.49153: Flags [.], ack 5921, win 501, options [nop,nop,TS val 1100612854 ecr 1885669849], length 0
13:38:37.182390 IP 10.10.10.201.7000 > 10.10.10.11.57570: Flags [.], ack 1434, win 2048, length 0
13:38:37.182462 IP 10.10.10.11.57570 > 10.10.10.201.7000: Flags [.], ack 1083, win 501, options [nop,nop,TS val 1100618735 ecr 1885669722], length 0
13:38:38.536925 IP 10.10.10.201.5353 > 224.0.0.251.5353: 0*- [0q] 2/0/6 TXT "model=J42dAP", PTR Woonkamer._companion-link._tcp.local. (372)
^C
93 packets captured
93 packets received by filter
0 packets dropped by kernel
```

**Logs from homeassistant debug log:**
```
2020-04-15 15:37:59 DEBUG (MainThread) [pyatv] Discovering devices for 3 seconds
2020-04-15 15:38:00 DEBUG (MainThread) [pyatv] Auto-discovered Woonkamer at 10.10.10.201:49153 (Protocol.MRP)
2020-04-15 15:38:00 DEBUG (MainThread) [pyatv] Auto-discovered Woonkamer at 10.10.10.201:7000 (Protocol.AirPlay)
2020-04-15 15:38:18 DEBUG (MainThread) [pyatv.mrp.connection] Connected to device
2020-04-15 15:38:18 DEBUG (MainThread) [pyatv.mrp.connection] >> Send (Data=080f122437303130663338642d313365662d343565322d623036302d3331666635333134316135302000a20183010a2438663235316138392d383561662d343638382d393735302d323464623534373532373439120570796174761a066950686f6e6522063137423131312a12636f6d2e6170706c652e545652656d6f746532063334342e32383801404d480150016211636f6d2e6170706c652e54564d75736963680170017801880102a80101b00101)
2020-04-15 15:38:18 DEBUG (MainThread) [pyatv.mrp.connection] >> Send: Protobuf: type: DEVICE_INFO_MESSAGE
identifier: "7010f38d-13ef-45e2-b060-31ff53141a50"
errorCode: 0
[deviceInfoMessage] {
  uniqueIdentifier: "8f251a89-85af-4688-9750-24db54752749"
  name: "pyatv"
  localizedModelName: "iPhone"
  systemBuildVersion: "17B111"
  applicationBundleIdentifier: "com.apple.TVRemote"
  applicationBundleVersion: "344.28"
  protocolVersion: 1
  lastSupportedMessageType: 77
  supportsSystemPairing: true
  allowsPairing: true
  systemMediaApplication: "com.apple.TVMusic"
  supportsACL: true
  supportsSharedQueue: true
  supportsExtendedMotion: true
  sharedQueueVersion: 2
  deviceClass: 1
  logicalDeviceCount: 1
}
2020-04-15 15:38:18 DEBUG (MainThread) [pyatv.mrp.connection] << Receive (Data=e702080f122437303130663338642d313365662d343565322d623036302d3331666635333134316135302000a201b9020a2439354532373937442d373341452d344341462d423544322d4133344239303634303535421209576f6f6e6b616d65721a094170706c65c2a05456220631374c3235362a16636f6d2e6170706c652e6d6564696172656d6f7465643801404e480150016211636f6d2e6170706c652e54564d757369636801700178018801029a012442323244413341422d384546422d343641332d383143352d423232463545333731344438a2011130343a34623a65643a62303a39373a6333a80104b00101c00100d20124314442333635303...)
2020-04-15 15:38:18 DEBUG (MainThread) [pyatv.mrp.connection] << Receive: Protobuf: type: DEVICE_INFO_MESSAGE
identifier: "7010f38d-13ef-45e2-b060-31ff53141a50"
errorCode: 0
[deviceInfoMessage] {
  uniqueIdentifier: "95E2797D-73AE-4CAF-B5D2-A34B9064055B"
  name: "Woonkamer"
  localizedModelName: "Apple\302\240TV"
  systemBuildVersion: "17L256"
  applicationBundleIdentifier: "com.apple.mediaremoted"
  protocolVersion: 1
  lastSupportedMessageType: 78
  supportsSystemPairing: true
  allowsPairing: true
  systemMediaApplication: "com.apple.TVMusic"
  supportsACL: true
  supportsSharedQueue: true
  supportsExtendedMotion: true
  sharedQueueVersion: 2
  deviceUID: "B22DA3AB-8EFB-46A3-81C5-B22F5E3714D8"
  managedConfigDeviceID: "04:4b:ed:b0:97:c3"
  deviceClass: 4
  logicalDeviceCount: 1
  isProxyGroupPlayer: false
  groupUID: "1DB36503-95D4-4D8A-975D-63B442F64B31"
  isGroupLeader: true
  isAirplayActive: false
  systemPodcastApplication: "com.apple.podcasts"
  enderDefaultGroupUID: "1DB36503-95D4-4D8A-975D-63B442F64B31"
  airplayReceivers: "TVAirPlay"
}
2020-04-15 15:38:18 DEBUG (MainThread) [pyatv.mrp.connection] >> Send (Data=08222000ba02100a060001000601011000180020002802)
2020-04-15 15:38:18 DEBUG (MainThread) [pyatv.mrp.connection] >> Send: Protobuf: type: CRYPTO_PAIRING_MESSAGE
errorCode: 0
[cryptoPairingMessage] {
  pairingData: "\000\001\000\006\001\001"
  status: 0
  isRetrying: false
  isUsingSystemPairing: false
  state: 2
}
2020-04-15 15:38:19 DEBUG (MainThread) [pyatv.mrp.connection] << Receive (Data=ac0308222000ba02a4030a990306010202100d8b3b1ade95349688f9d14680caad0403ffb3e5d471f280a0da8d4ba0ef965f0ddd118f0d7fcf346c5273486f5c08c0eef6cf530ddf5dbbe2f0ccc7eff7167e7b7317d31b20e7b0fa109833259bc77cabab871455a6eae06d5019657bed8aef23d8eb9981d7b2ebec7ac050d7fc54dff4e87a9dbbb443130a3443e955e8b58b879ee727cb97d6f233fe90e3447d0fc753acddb3cbb25d223f0321a275cd8b1f9693e374208cb697c9400d7a9baa3911499f17f8c828bdc9781d2f2a9f0e3fcbfd054ce6837ccbf4c5da5163e02ff5d15299ccdecc34c0dcc05567adcb33ec06b93f51bd7c62f82e1c6b187ae...)
2020-04-15 15:38:19 DEBUG (MainThread) [pyatv.mrp.connection] << Receive: Protobuf: type: CRYPTO_PAIRING_MESSAGE
errorCode: 0
[cryptoPairingMessage] {
  pairingData: "\006\001\002\002\020\r\213;\032\336\2254\226\210\371\321F\200\312\255\004\003\377\263\345\324q\362\200\240\332\215K\240\357\226_\r\...
  status: 0
  isRetrying: false
  isUsingSystemPairing: false
  state: 0
}
2020-04-15 15:38:25 DEBUG (MainThread) [pyatv.mrp.srp] Client (Proof=5c816b90d381b8ba2055369652b13275add959d0ea2a64f9c5b83b8c2087dd5b3a6f666bcbb14556a49fc6b4d68ddb257b470c1358617d6fa99bd98774ef97aa, Public=c7f5cf8f024d9aef1f21ce7f2ab25637a92962c3b1c84fec076935de3b7a1d9ad3c325c3848341a91b0bf780e4d766701746c47ac283bbcda84d6f28554570d0020f0e2d055e205b102d354cca80b8b9fcad33f17928790ade5c580cd15daaa5532d7b5bfebb999e228f0e601b3bf5a51452b55993de51781b67690509f34a832ec170635ef1b799ddf748a558cd0ce6f1ed1fb2eacb3a1fdec68f8a2dba201edec0e36b6f1ad5071e2f8c702e2e0b1623f2f2fcb6f3813b55b513ac9bc5ddeb6ad7231c4b04db5889ab0ba91f45816f743a58b63fc780949aa66e8ce57d6871e31ba415663ae7d954dd13e2a178a69212517307706467d616b367d841975...)
2020-04-15 15:38:25 DEBUG (MainThread) [pyatv.mrp.connection] >> Send (Data=08222000ba02d4030ac90306010303ffc7f5cf8f024d9aef1f21ce7f2ab25637a92962c3b1c84fec076935de3b7a1d9ad3c325c3848341a91b0bf780e4d766701746c47ac283bbcda84d6f28554570d0020f0e2d055e205b102d354cca80b8b9fcad33f17928790ade5c580cd15daaa5532d7b5bfebb999e228f0e601b3bf5a51452b55993de51781b67690509f34a832ec170635ef1b799ddf748a558cd0ce6f1ed1fb2eacb3a1fdec68f8a2dba201edec0e36b6f1ad5071e2f8c702e2e0b1623f2f2fcb6f3813b55b513ac9bc5ddeb6ad7231c4b04db5889ab0ba91f45816f743a58b63fc780949aa66e8ce57d6871e31ba415663ae7d954dd13e2a178a...)
2020-04-15 15:38:25 DEBUG (MainThread) [pyatv.mrp.connection] >> Send: Protobuf: type: CRYPTO_PAIRING_MESSAGE
errorCode: 0
[cryptoPairingMessage] {
  pairingData: "\006\001\003\003\377\307\365\317\217\002M\232\357\037!\316\177*\262V7\251)b\303\261\310O\354\007i5\336;z\035\232\323\303%\303\204\2...
  status: 0
  isRetrying: false
  isUsingSystemPairing: false
  state: 0
}
2020-04-15 15:38:25 DEBUG (MainThread) [pyatv.mrp.connection] << Receive (Data=5608222000ba024f0a450601040440d082a135489815e779363db535b9badd2018bb0c8277c55ed1167a37ab13747c46577f33794cbc39a9f09a228aa25f1a5a39f2f3b41c8698a6960da4423afe5e1000180020002800)
2020-04-15 15:38:25 DEBUG (MainThread) [pyatv.mrp.connection] << Receive: Protobuf: type: CRYPTO_PAIRING_MESSAGE
errorCode: 0
[cryptoPairingMessage] {
  pairingData: "\006\001\004\004@\320\202\2415H\230\025\347y6=\2655\271\272\335 \030\273\014\202w\305^\321\026z7\253\023t|FW\1773yL\2749\251\360\23...
  status: 0
  isRetrying: false
  isUsingSystemPairing: false
  state: 0
}
2020-04-15 15:38:25 DEBUG (MainThread) [pyatv.mrp.auth] Device (Proof=d082a135489815e779363db535b9badd2018bb0c8277c55ed1167a37ab13747c46577f33794cbc39a9f09a228aa25f1a5a39f2f3b41c8698a6960da4423afe5e)
2020-04-15 15:38:25 DEBUG (MainThread) [pyatv.mrp.srp] Data (Encrypted=19ef63fb034bb21c08277322b29f0e45c292009021f9b7e36df8b41bb0c85f2158317f7f3a98f8d859a379ac13838c1d5f012ef15a6d463b5791539c456c25599f1c9b831db7a645a241c02d1a6b47b6a2f250277b15ee2d366878363cbdee067dfdc2ea508236cbe71a4bb9eb1ed66fd6297b4bd04887a4ddeb9b9bf8075b5b5d91344aef98208507e35c31532190c43ea2217d2dd2a79b5746)
2020-04-15 15:38:25 DEBUG (MainThread) [pyatv.mrp.connection] >> Send (Data=08222000ba02aa010a9f01060105059a19ef63fb034bb21c08277322b29f0e45c292009021f9b7e36df8b41bb0c85f2158317f7f3a98f8d859a379ac13838c1d5f012ef15a6d463b5791539c456c25599f1c9b831db7a645a241c02d1a6b47b6a2f250277b15ee2d366878363cbdee067dfdc2ea508236cbe71a4bb9eb1ed66fd6297b4bd04887a4ddeb9b9bf8075b5b5d91344aef98208507e35c31532190c43ea2217d2dd2a79b57461000180020002800)
2020-04-15 15:38:25 DEBUG (MainThread) [pyatv.mrp.connection] >> Send: Protobuf: type: CRYPTO_PAIRING_MESSAGE
errorCode: 0
[cryptoPairingMessage] {
  pairingData: "\006\001\005\005\232\031\357c\373\003K\262\034\010\'s\"\262\237\016E\302\222\000\220!\371\267\343m\370\264\033\260\310_!X1\177\177:...
  status: 0
  isRetrying: false
  isUsingSystemPairing: false
  state: 0
}
2020-04-15 15:38:25 DEBUG (MainThread) [pyatv.mrp.connection] << Receive (Data=b20108222000ba02aa010a9f01059a516e2d509f839c881e738b799af8f70baf072b44c2ce8e0bfe4c5d8984576b0ec54b5423e6f62dc5957b78a82daa7aced454e7e3ae2f1a57ca8b7e51dcf4bb88451f2abb6ff69f2d6246eeec683f9ace2382ca7978450a963304640b62f73d520445276bd187125980922a8b0a9c69c68c318d231f23e0c43fdc1ed075d7cc8ae92ed7c3277e0e9e256ceedba76ac6c4360b2a652f4c855d5c9b0601061000180020002800)
2020-04-15 15:38:25 DEBUG (MainThread) [pyatv.mrp.connection] << Receive: Protobuf: type: CRYPTO_PAIRING_MESSAGE
errorCode: 0
[cryptoPairingMessage] {
  pairingData: "\005\232Qn-P\237\203\234\210\036s\213y\232\370\367\013\257\007+D\302\316\216\013\376L]\211\204Wk\016\305KT#\346\366-\305\225{x\250-...
  status: 0
  isRetrying: false
  isUsingSystemPairing: false
  state: 0
}
2020-04-15 15:38:25 DEBUG (MainThread) [pyatv.mrp.srp] PS-Msg06: {'1': b'b7454172-60e0-4444-9426-89b2d6b93c6a', '3': b'\x1a\x92O\xc6YC\x8b\x9e$\xdd\x83f2\xd2n7\xb1P\x88\x82\xdc\xe3\xc9\r\xfa\xc5\xcfCl\x8b\x86\xeb', '10': b"\x89MR\xbc\x18\x80wX\xcd\xdeX\xf0\xde\x0f\tx\xfa\x10H\xacx\xaf\x9d\x11\xbe\tW':\x0f\xbd\xa7s\x7f\xde\xdbg\xcf\xea\x88\xd2f7rP_\x9801\xa8\xf6\x8a5q\x16|\xfa\xf7\xbd}\xdd\xdd\xde\x0b"}
2020-04-15 15:38:25 DEBUG (MainThread) [pyatv.mrp.srp] Device (Identifier=62373435343137322d363065302d343434342d393432362d383962326436623933633661, Public=1a924fc659438b9e24dd836632d26e37b1508882dce3c90dfac5cf436c8b86eb, Signature=894d52bc18807758cdde58f0de0f0978fa1048ac78af9d11be0957273a0fbda7737fdedb67cfea88d2663772505f983031a8f68a3571167cfaf7bd7dddddde0b)
2020-04-15 15:38:25 DEBUG (MainThread) [pyatv.airplay.srp] Authentication keys (Private=bdaa22d75d86655118c7c01091347baadc3995427a67328825a4bef16da32e7f, Public=767dc8bdc0591d423b57efcbc9e6bbda8b46f4bb8fd1a6c8957a50c9a695bddd)
2020-04-15 15:38:25 DEBUG (MainThread) [pyatv.airplay.pairing] Starting AirPlay pairing with credentials 86BF16C9D54796E3:BDAA22D75D86655118C7C01091347BAADC3995427A67328825A4BEF16DA32E7F
2020-04-15 15:38:25 DEBUG (MainThread) [pyatv.support.net] POST URL: http://10.10.10.201:7000/pair-pin-start
2020-04-15 15:38:25 DEBUG (MainThread) [pyatv.mrp.connection] Disconnected from device: None
2020-04-15 15:38:30 DEBUG (MainThread) [pyatv.support.net] POST URL: http://10.10.10.201:7000/pair-setup-pin
2020-04-15 15:38:30 DEBUG (MainThread) [pyatv.support.net] -> Data[85]: b'62706c6973743030d201020304566d6574686f6454757365725370696e5f101038364246313643394435343739364533080d14191d0000000000000101000000000000000500000000000000000000000000000030'
2020-04-15 15:38:30 DEBUG (MainThread) [pyatv.support.net] <- Data[342]: b'62706c6973743030d20102030452706b5473616c744f11010066867abf64acb89d5e08d0097e926692e3b6777126bd23fd6f2f2ce9e8cd30eba85bf6abfe7a8dadaaaf4a865052fd6ab539eb6994c0d8e2c7bc2fde3840850c539cc0354acdb8db6ab12b5cd4b432667238ac43252a344cb70d97a4ef5e40ec521e93831240b9'...
2020-04-15 15:38:30 DEBUG (MainThread) [pyatv.airplay.srp] Client session key: b'3a774f8ef4ed0b55e033bca0fdab53e1f1fae924aaa9a8d89fe954015f5d43eef99e35bd40234bba'
2020-04-15 15:38:30 DEBUG (MainThread) [pyatv.airplay.srp] Client public: 9f8aec8ef9a3e279cbba930410b3410fa6693151c802f693f9267e23387cb554fe77149fd6e7459a155f2987bca2846bf1470f852cd720cd32d638ee176e5a68ebcf1e51b693e24d2b51935492c2ce5d671923dd89094b0c8fac994d5cec6fcd32d78bbdab3929a05b2b00b774478a0220421f331d21461a7ab5f95325f2183c78181399ca419390a4a02c048854555a54e239b514e57302ed50ef278159cd2353aa1988d931f321bc42fa539c0cba0c4900e5337ecd038dbcc05077fe4de567ab3e644869040808661e0739c2c5795fbf6f73f8050a90aae81283ac0dc274ec4582d896247f704f05a3fcb7ebb096f3b0f5a10f581b8eb55cde522ea15d77df, proof: b'5d9e868c5b4e8f806a0ff827cf8f3baa213dec9e'
2020-04-15 15:38:30 DEBUG (MainThread) [pyatv.support.net] POST URL: http://10.10.10.201:7000/pair-setup-pin
2020-04-15 15:38:30 DEBUG (MainThread) [pyatv.support.net] -> Data[347]: b'62706c6973743030d20102030452706b5570726f6f664f1101009f8aec8ef9a3e279cbba930410b3410fa6693151c802f693f9267e23387cb554fe77149fd6e7459a155f2987bca2846bf1470f852cd720cd32d638ee176e5a68ebcf1e51b693e24d2b51935492c2ce5d671923dd89094b0c8fac994d5cec6fcd32d78bbdab39'...
2020-04-15 15:38:31 DEBUG (MainThread) [pyatv.support.net] <- Data[75]: b'62706c6973743030d101025570726f6f664f101411604b731168ebd46d4e57b0c5cdf83b437b2feb080b110000000000000101000000000000000300000000000000000000000000000028'
2020-04-15 15:38:31 DEBUG (MainThread) [pyatv.airplay.srp] Pair-Setup-AES (IV=3464eac3560ed97839e57940a3746c3e, Key=a1fe2ad181c92159eba4743469f534e4)
2020-04-15 15:38:31 DEBUG (MainThread) [pyatv.airplay.srp] Pair-Setup EPK+Tag (EPK=01e86b6c8a0bd85b080610c43d01ac0461d2da737d5c57b355cb5b790d8b07bf, Tag=1d7afbb535fd138885b81ce1f95e53b2)
2020-04-15 15:38:31 DEBUG (MainThread) [pyatv.support.net] POST URL: http://10.10.10.201:7000/pair-setup-pin
2020-04-15 15:38:31 DEBUG (MainThread) [pyatv.support.net] -> Data[116]: b'62706c6973743030d20102030457617574685461675365706b4f10101d7afbb535fd138885b81ce1f95e53b24f102001e86b6c8a0bd85b080610c43d01ac0461d2da737d5c57b355cb5b790d8b07bf080d15192c000000000000010100000000000000050000000000000000000000000000004f'
2020-04-15 15:38:31 DEBUG (MainThread) [pyatv.support.net] <- Data[116]: 
```

**Comment by postlund** [comment]
@bramhendriks Cool, that looks good! Then we at least know the reason for this.

**Comment by postlund** [comment]
And also that this is a limitation in the Apple TV/zeroconf that I cannot do something about in `pyatv`. Just to be clear.

**Comment by bramhendriks** [comment]
Yes, i noticed that i can't use the Apple TV remote app (the one that apple created themself) at the moment, my users (wi-fi/wired) are in vlan 50, my servers and network equiptment is in vlan 10. I will try to dual home my hassio server (one ethernet interface in vlan 10, one in vlan 50) but i need to change some network config for that.

**Comment by postlund** [comment]
Yeah, that's a side-effect here. It's not really designed for being accessed from two different subnets at the same time. Making a connection between two different subnets works fine though. But I assume your VLANs are isolated, so that doesn't help (otherwise you can put up a mDNS proxy between the networks). Putting Home Assistant in the two VLANs are probably the best solution. Another solution would be to use `atvproxy`, that way you can use the remote app as well. It is not found by the action center widget for some reason though, so that's a downside.

Documentation about `atvproxy` is here if you are interested:

https://pyatv.dev/documentation/atvproxy/

It's still quite early in development, but I can help add features if you are missing anything.

**Comment by postlund** [comment]
So, I pushed #586 which fixes #581. An exception is raised whenever scanning for an address on a foreign subnet (example with `atvremote`):

```shell
$ atvremote -s 10.0.0.1 playing
Traceback (most recent call last):
  File "/home/postlund/pyatv_dev/pyatv/pyatv/scripts/atvremote.py", line 641, in _run_application
    return await cli_handler(loop)
  File "/home/postlund/pyatv_dev/pyatv/pyatv/scripts/atvremote.py", line 451, in cli_handler
    config = await _autodiscover_device(args, loop)
  File "/home/postlund/pyatv_dev/pyatv/pyatv/scripts/atvremote.py", line 473, in _autodiscover_device
    apple_tv = await _scan_for_device(
  File "/home/postlund/pyatv_dev/pyatv/pyatv/scripts/atvremote.py", line 43, in _scan_for_device
    atvs = await scan(loop, **options)
  File "/home/postlund/pyatv_dev/pyatv/pyatv/__init__.py", line 276, in scan
    devices = (await scanner.discover(timeout)).values()
  File "/home/postlund/pyatv_dev/pyatv/pyatv/__init__.py", line 196, in discover
    results = await asyncio.gather(
  File "/home/postlund/pyatv_dev/pyatv/pyatv/__init__.py", line 208, in _get_services
    response = await udns.request(
  File "/home/postlund/pyatv_dev/pyatv/pyatv/support/udns.py", line 256, in request
    raise exceptions.NonLocalSubnetError(
pyatv.exceptions.NonLocalSubnetError: address 10.0.0.1 is not in any local subnet

>>> An error occurred, full stack trace above
```

I will make sure to catch this in the component and show a proper error message.

**Comment by postlund** [comment]
@simonszu Can you by any chance verify if it works when moving Home Assistant to the same subnet as the Apple TV?

**Comment by simonszu** [comment]
I can, and i would love to, however, currently i'm lacking some time. There are several other projects which requre my attention as well. Maybe during the weekend...

**Comment by postlund** [comment]
Great, no worries! Do it when you have some time 👍

**Comment by simonszu** [comment]
Yes, so i can confirm after i have switched the HA docker container to use the host network, it is able to connect to the Apple TV.

**Comment by postlund** [comment]
Great, thanks for verifying!
